{
  "id": "30_habit_orchestra",
  "index": 30,
  "slug": "habit_orchestra",
  "title": "Habit Orchestra",
  "caption": "Three vertical mirrors. Conduct three phrases.",
  "act": "mastery",
  "act_index": 3,
  "act_title": "Mastery",
  "teaches": "composition",
  "transform": "mirror_v",
  "difficulty": 5,
  "role": "remix",
  "seed": 14004,
  "daily_eligible": true,
  "par_moves": 95,
  "tempo_start": 9999,
  "lattice": {
    "rows": 14,
    "cols": 24,
    "cells": [
      "########################",
      "#P.....................#",
      "#.####.##########.####.#",
      "#..C...................#",
      "#.####.##########.####.#",
      "#......................#",
      "#.####.##########.####.#",
      "#..........C...........#",
      "#.####.##########.####.#",
      "#...................C..#",
      "#.####.##########.####.#",
      "#......................#",
      "#.....................G#",
      "########################"
    ]
  },
  "map": [
    "########################",
    "#P.....................#",
    "#.####.##########.####.#",
    "#..C...................#",
    "#.####.##########.####.#",
    "#......................#",
    "#.####.##########.####.#",
    "#..........C...........#",
    "#.####.##########.####.#",
    "#...................C..#",
    "#.####.##########.####.#",
    "#......................#",
    "#.....................G#",
    "########################"
  ],
  "motifs": [
    {
      "id": "M1",
      "kind": "CHECKPOINT",
      "cell": [
        3,
        3
      ],
      "unique": true,
      "operator": "mirror_v",
      "banner": "Three vertical mirrors. Conduct three phrases."
    },
    {
      "id": "M2",
      "kind": "CHECKPOINT",
      "cell": [
        11,
        7
      ],
      "unique": true,
      "operator": "mirror_v",
      "banner": ""
    },
    {
      "id": "M3",
      "kind": "CHECKPOINT",
      "cell": [
        20,
        9
      ],
      "unique": true,
      "operator": "mirror_v",
      "banner": ""
    }
  ],
  "resonance": {
    "kind": "REACH_GOAL"
  },
  "rewrite": {
    "cap": 3,
    "forced_op": "mirror_v",
    "soft_hard_bias": 0.8500000000000001,
    "require_shorter_or_equal": false
  },
  "hints": [],
  "variations": {
    "allow_rotate": false,
    "allow_reflect": false,
    "allow_palette_swap": true,
    "budget_deltas": [
      0
    ],
    "hard_mode": {
      "tempo_delta": -8,
      "par_moves_mult": 0.85
    }
  },
  "unlocks": [],
  "tags": [
    "mastery",
    "composition",
    "mirror_v",
    "remix"
  ]
}
