{
  "id": "34_open_lattice",
  "index": 34,
  "slug": "open_lattice",
  "title": "Open Lattice",
  "caption": "Epilogue. Same seed a friend can share.",
  "act": "mastery",
  "act_index": 3,
  "act_title": "Mastery",
  "teaches": "free",
  "transform": "mirror_v",
  "difficulty": 4,
  "role": "daily_showcase",
  "seed": 14008,
  "daily_eligible": true,
  "par_moves": 64,
  "tempo_start": 9999,
  "lattice": {
    "rows": 14,
    "cols": 24,
    "cells": [
      "########################",
      "#P.....................#",
      "#.#####.#####.#####.##.#",
      "#......................#",
      "#.#####.C###.#####.###.#",
      "#......................#",
      "#.#####.#####.#####.##.#",
      "#......................#",
      "#.#####.#####.#####.##.#",
      "#..........C...........#",
      "#.#####.#####.#####.##.#",
      "#......................#",
      "#.....................G#",
      "########################"
    ]
  },
  "map": [
    "########################",
    "#P.....................#",
    "#.#####.#####.#####.##.#",
    "#......................#",
    "#.#####.C###.#####.###.#",
    "#......................#",
    "#.#####.#####.#####.##.#",
    "#......................#",
    "#.#####.#####.#####.##.#",
    "#..........C...........#",
    "#.#####.#####.#####.##.#",
    "#......................#",
    "#.....................G#",
    "########################"
  ],
  "motifs": [
    {
      "id": "M1",
      "kind": "CHECKPOINT",
      "cell": [
        8,
        4
      ],
      "unique": true,
      "operator": "mirror_v",
      "banner": "Epilogue. Same seed a friend can share."
    },
    {
      "id": "M2",
      "kind": "CHECKPOINT",
      "cell": [
        11,
        9
      ],
      "unique": true,
      "operator": "mirror_v",
      "banner": ""
    }
  ],
  "resonance": {
    "kind": "REACH_GOAL"
  },
  "rewrite": {
    "cap": 3,
    "forced_op": "mirror_v",
    "soft_hard_bias": 0.8500000000000001,
    "require_shorter_or_equal": false
  },
  "hints": [
    "Daily mode starts here \u2014 compare ghosts with a friend."
  ],
  "variations": {
    "allow_rotate": false,
    "allow_reflect": true,
    "allow_palette_swap": true,
    "budget_deltas": [
      0
    ],
    "hard_mode": {
      "tempo_delta": -8,
      "par_moves_mult": 0.85
    }
  },
  "unlocks": [],
  "tags": [
    "mastery",
    "free",
    "mirror_v",
    "daily_showcase"
  ]
}
