{
  "id": "13_gallery_walk",
  "index": 13,
  "slug": "gallery_walk",
  "title": "Gallery Walk",
  "caption": "A colonnade of pillars. Reflect carefully.",
  "act": "reflection",
  "act_index": 1,
  "act_title": "Reflection",
  "teaches": "mirror_v",
  "transform": "mirror_v",
  "difficulty": 3,
  "role": "remix",
  "seed": 12005,
  "daily_eligible": true,
  "par_moves": 64,
  "tempo_start": 9999,
  "lattice": {
    "rows": 14,
    "cols": 24,
    "cells": [
      "########################",
      "#P.....................#",
      "#.#.###.#.###.#.###.#.##",
      "#......................#",
      "##.###.#.###.#.###.#.###",
      "#..........C...........#",
      "#.#.###.#.###.#.###.#.##",
      "#......................#",
      "##.###.#.###.#.###.#.###",
      "#......................#",
      "#.#.###.#.###.#.###.#.##",
      "#......................#",
      "#.....................G#",
      "########################"
    ]
  },
  "map": [
    "########################",
    "#P.....................#",
    "#.#.###.#.###.#.###.#.##",
    "#......................#",
    "##.###.#.###.#.###.#.###",
    "#..........C...........#",
    "#.#.###.#.###.#.###.#.##",
    "#......................#",
    "##.###.#.###.#.###.#.###",
    "#......................#",
    "#.#.###.#.###.#.###.#.##",
    "#......................#",
    "#.....................G#",
    "########################"
  ],
  "motifs": [
    {
      "id": "M1",
      "kind": "CHECKPOINT",
      "cell": [
        11,
        5
      ],
      "unique": true,
      "operator": "mirror_v",
      "banner": "A colonnade of pillars. Reflect carefully."
    }
  ],
  "resonance": {
    "kind": "REACH_GOAL"
  },
  "rewrite": {
    "cap": 2,
    "forced_op": "mirror_v",
    "soft_hard_bias": 0.45,
    "require_shorter_or_equal": false
  },
  "hints": [
    "Pillars lie about symmetry. Commit when your half is clean."
  ],
  "variations": {
    "allow_rotate": false,
    "allow_reflect": false,
    "allow_palette_swap": true,
    "budget_deltas": [
      0
    ],
    "hard_mode": {
      "tempo_delta": -8,
      "par_moves_mult": 0.85
    }
  },
  "unlocks": [],
  "tags": [
    "reflection",
    "mirror_v",
    "mirror_v",
    "remix"
  ]
}
