{
  "id": "33_nameplate",
  "index": 33,
  "slug": "nameplate",
  "title": "Nameplate",
  "caption": "Boss. Final identity \u2014 sign the lattice.",
  "act": "mastery",
  "act_index": 3,
  "act_title": "Mastery",
  "teaches": "identity",
  "transform": "mirror_v_then_h",
  "difficulty": 5,
  "role": "boss",
  "identity": "mastery_nameplate",
  "seed": 14007,
  "daily_eligible": true,
  "par_moves": 100,
  "tempo_start": 9999,
  "lattice": {
    "rows": 14,
    "cols": 24,
    "cells": [
      "########################",
      "#P.....................#",
      "#..###.###.###.###.###.#",
      "#......................#",
      "#.C....................#",
      "#..###.###.###.###.###.#",
      "#......................#",
      "#..........C...........#",
      "#..###.###.###.###.###.#",
      "#......................#",
      "#....................C.#",
      "#..###.###.###.###.###.#",
      "#.....................G#",
      "########################"
    ]
  },
  "map": [
    "########################",
    "#P.....................#",
    "#..###.###.###.###.###.#",
    "#......................#",
    "#.C....................#",
    "#..###.###.###.###.###.#",
    "#......................#",
    "#..........C...........#",
    "#..###.###.###.###.###.#",
    "#......................#",
    "#....................C.#",
    "#..###.###.###.###.###.#",
    "#.....................G#",
    "########################"
  ],
  "motifs": [
    {
      "id": "M1",
      "kind": "CHECKPOINT",
      "cell": [
        2,
        4
      ],
      "unique": true,
      "operator": "mirror_v_then_h",
      "banner": "Boss. Final identity \u2014 sign the lattice."
    },
    {
      "id": "M2",
      "kind": "CHECKPOINT",
      "cell": [
        11,
        7
      ],
      "unique": true,
      "operator": "mirror_v_then_h",
      "banner": ""
    },
    {
      "id": "M3",
      "kind": "CHECKPOINT",
      "cell": [
        21,
        10
      ],
      "unique": true,
      "operator": "mirror_v_then_h",
      "banner": ""
    }
  ],
  "resonance": {
    "kind": "REACH_GOAL"
  },
  "rewrite": {
    "cap": 3,
    "forced_op": "mirror_v_then_h",
    "soft_hard_bias": 0.8500000000000001,
    "require_shorter_or_equal": false
  },
  "hints": [
    "Three commits. Each phrase should rhyme with the last.",
    "The nameplate is readable when echo walls form letters of path."
  ],
  "variations": {
    "allow_rotate": false,
    "allow_reflect": false,
    "allow_palette_swap": true,
    "budget_deltas": [
      0
    ],
    "hard_mode": {
      "tempo_delta": -8,
      "par_moves_mult": 0.85
    }
  },
  "unlocks": [],
  "tags": [
    "mastery",
    "identity",
    "mirror_v_then_h",
    "boss"
  ]
}
