{
  "id": "09_twin_rail",
  "index": 9,
  "slug": "twin_rail",
  "title": "Twin Rail",
  "caption": "A narrow spine. Your left becomes your right.",
  "act": "reflection",
  "act_index": 1,
  "act_title": "Reflection",
  "teaches": "mirror_v",
  "transform": "mirror_v",
  "difficulty": 2,
  "role": "lesson",
  "seed": 12001,
  "daily_eligible": true,
  "par_moves": 50,
  "tempo_start": 9999,
  "lattice": {
    "rows": 14,
    "cols": 24,
    "cells": [
      "########################",
      "#P........##...........#",
      "#.#######.##.#########.#",
      "#.......#.##.........#.#",
      "#.#####.#.##.#######.#.#",
      "#.....#.#.##.......#.#.#",
      "#.###.#.C.##.#####.#.#.#",
      "#.....#.#.##.......#.#.#",
      "#.#####.#.##.#######.#.#",
      "#.......#.##.........#.#",
      "#.#######.##.#########.#",
      "#......................#",
      "#.....................G#",
      "########################"
    ]
  },
  "map": [
    "########################",
    "#P........##...........#",
    "#.#######.##.#########.#",
    "#.......#.##.........#.#",
    "#.#####.#.##.#######.#.#",
    "#.....#.#.##.......#.#.#",
    "#.###.#.C.##.#####.#.#.#",
    "#.....#.#.##.......#.#.#",
    "#.#####.#.##.#######.#.#",
    "#.......#.##.........#.#",
    "#.#######.##.#########.#",
    "#......................#",
    "#.....................G#",
    "########################"
  ],
  "motifs": [
    {
      "id": "M1",
      "kind": "CHECKPOINT",
      "cell": [
        8,
        6
      ],
      "unique": true,
      "operator": "mirror_v",
      "banner": "A narrow spine. Your left becomes your right."
    }
  ],
  "resonance": {
    "kind": "REACH_GOAL"
  },
  "rewrite": {
    "cap": 2,
    "forced_op": "mirror_v",
    "soft_hard_bias": 0.45,
    "require_shorter_or_equal": false
  },
  "hints": [
    "Stay on the left spine until the checkpoint."
  ],
  "variations": {
    "allow_rotate": false,
    "allow_reflect": false,
    "allow_palette_swap": true,
    "budget_deltas": [
      0
    ],
    "hard_mode": {
      "tempo_delta": -4,
      "par_moves_mult": 0.85
    }
  },
  "unlocks": [],
  "tags": [
    "reflection",
    "mirror_v",
    "mirror_v",
    "lesson"
  ]
}
