{
  "id": "38_nameplate_hard",
  "index": 38,
  "slug": "nameplate_hard",
  "title": "Nameplate+",
  "caption": "Hard. Final identity with less breathing room.",
  "act": "mastery",
  "act_index": 3,
  "act_title": "Mastery",
  "teaches": "identity",
  "transform": "mirror_v_then_h",
  "difficulty": 5,
  "role": "hard",
  "identity": "mastery_nameplate_hard",
  "seed": 24007,
  "daily_eligible": true,
  "hard_variant_of": "nameplate",
  "par_moves": 110,
  "tempo_start": 9999,
  "lattice": {
    "rows": 14,
    "cols": 24,
    "cells": [
      "########################",
      "#P.........#...........#",
      "#.####.###.#.###.#######",
      "#..........#...........#",
      "#.####.###.C.###.#######",
      "#..........#...........#",
      "#.####.###.#.###.#######",
      "#..........C...........#",
      "#.####.###.#.###.#######",
      "#..........#...........#",
      "#.####.###.C.###.#######",
      "#..........#...........#",
      "#..........#..........G#",
      "########################"
    ]
  },
  "map": [
    "########################",
    "#P.........#...........#",
    "#.####.###.#.###.#######",
    "#..........#...........#",
    "#.####.###.C.###.#######",
    "#..........#...........#",
    "#.####.###.#.###.#######",
    "#..........C...........#",
    "#.####.###.#.###.#######",
    "#..........#...........#",
    "#.####.###.C.###.#######",
    "#..........#...........#",
    "#..........#..........G#",
    "########################"
  ],
  "motifs": [
    {
      "id": "M1",
      "kind": "CHECKPOINT",
      "cell": [
        11,
        4
      ],
      "unique": true,
      "operator": "mirror_v_then_h",
      "banner": "Hard. Final identity with less breathing room."
    },
    {
      "id": "M2",
      "kind": "CHECKPOINT",
      "cell": [
        11,
        7
      ],
      "unique": true,
      "operator": "mirror_v_then_h",
      "banner": ""
    },
    {
      "id": "M3",
      "kind": "CHECKPOINT",
      "cell": [
        11,
        10
      ],
      "unique": true,
      "operator": "mirror_v_then_h",
      "banner": ""
    }
  ],
  "resonance": {
    "kind": "REACH_GOAL"
  },
  "rewrite": {
    "cap": 3,
    "forced_op": "mirror_v_then_h",
    "soft_hard_bias": 0.8500000000000001,
    "require_shorter_or_equal": false
  },
  "hints": [],
  "variations": {
    "allow_rotate": false,
    "allow_reflect": true,
    "allow_palette_swap": true,
    "budget_deltas": [
      0,
      1
    ],
    "hard_mode": {
      "tempo_delta": -8,
      "par_moves_mult": 0.85
    }
  },
  "unlocks": [],
  "tags": [
    "mastery",
    "identity",
    "mirror_v_then_h",
    "hard"
  ]
}
