{
  "id": "05_two_glances",
  "index": 5,
  "slug": "two_glances",
  "title": "Two Glances",
  "caption": "Two checkpoints, two rewrites. Vary your route.",
  "act": "induction",
  "act_index": 0,
  "act_title": "Induction",
  "teaches": "mirror_v",
  "transform": "mirror_v",
  "difficulty": 2,
  "role": "remix",
  "seed": 11006,
  "daily_eligible": true,
  "par_moves": 55,
  "tempo_start": 9999,
  "lattice": {
    "rows": 14,
    "cols": 24,
    "cells": [
      "########################",
      "#P........#............#",
      "#.........#............#",
      "#.........#............#",
      "#....C....#............#",
      "#.........############.#",
      "#.........#............#",
      "#.........#............#",
      "#.........#....C.......#",
      "#.........#............#",
      "#.############.........#",
      "#......................#",
      "#......................G",
      "########################"
    ]
  },
  "map": [
    "########################",
    "#P........#............#",
    "#.........#............#",
    "#.........#............#",
    "#....C....#............#",
    "#.........############.#",
    "#.........#............#",
    "#.........#............#",
    "#.........#....C.......#",
    "#.........#............#",
    "#.############.........#",
    "#......................#",
    "#......................G",
    "########################"
  ],
  "motifs": [
    {
      "id": "M1",
      "kind": "CHECKPOINT",
      "cell": [
        5,
        4
      ],
      "unique": true,
      "operator": "mirror_v",
      "banner": "Two checkpoints, two rewrites. Vary your route."
    },
    {
      "id": "M2",
      "kind": "CHECKPOINT",
      "cell": [
        15,
        8
      ],
      "unique": true,
      "operator": "mirror_v",
      "banner": ""
    }
  ],
  "resonance": {
    "kind": "REACH_GOAL"
  },
  "rewrite": {
    "cap": 1,
    "forced_op": "mirror_v",
    "soft_hard_bias": 0.25,
    "require_shorter_or_equal": false
  },
  "hints": [
    "The second mirror uses only the path after the first."
  ],
  "variations": {
    "allow_rotate": false,
    "allow_reflect": false,
    "allow_palette_swap": true,
    "budget_deltas": [
      0
    ],
    "hard_mode": {
      "tempo_delta": -4,
      "par_moves_mult": 0.85
    }
  },
  "unlocks": [],
  "tags": [
    "induction",
    "mirror_v",
    "mirror_v",
    "remix"
  ]
}
