{
  "id": "25_panic_lattice",
  "index": 25,
  "slug": "panic_lattice",
  "title": "Panic Lattice",
  "caption": "Thicken in a maze of choices. Hesitation fills cells.",
  "act": "pressure",
  "act_index": 2,
  "act_title": "Pressure",
  "teaches": "thicken",
  "transform": "thicken",
  "difficulty": 4,
  "role": "remix",
  "seed": 13008,
  "daily_eligible": true,
  "par_moves": 74,
  "tempo_start": 9999,
  "lattice": {
    "rows": 14,
    "cols": 24,
    "cells": [
      "########################",
      "#P.....................#",
      "#.##.#############.##.##",
      "#......................#",
      "#.####.###.###.####.####",
      "#........C.............#",
      "#.####.###.###.####.####",
      "#......................#",
      "#.##.#############.##.##",
      "#......................#",
      "#.####.###.###.####.####",
      "#......................#",
      "#.....................G#",
      "########################"
    ]
  },
  "map": [
    "########################",
    "#P.....................#",
    "#.##.#############.##.##",
    "#......................#",
    "#.####.###.###.####.####",
    "#........C.............#",
    "#.####.###.###.####.####",
    "#......................#",
    "#.##.#############.##.##",
    "#......................#",
    "#.####.###.###.####.####",
    "#......................#",
    "#.....................G#",
    "########################"
  ],
  "motifs": [
    {
      "id": "M1",
      "kind": "CHECKPOINT",
      "cell": [
        9,
        5
      ],
      "unique": true,
      "operator": "thicken",
      "banner": "Thicken in a maze of choices. Hesitation fills cells."
    }
  ],
  "resonance": {
    "kind": "REACH_GOAL"
  },
  "rewrite": {
    "cap": 3,
    "forced_op": "thicken",
    "soft_hard_bias": 0.65,
    "require_shorter_or_equal": false
  },
  "hints": [
    "Hesitation thickens. Pick a lane and commit."
  ],
  "variations": {
    "allow_rotate": true,
    "allow_reflect": true,
    "allow_palette_swap": true,
    "budget_deltas": [
      0
    ],
    "hard_mode": {
      "tempo_delta": -8,
      "par_moves_mult": 0.85
    }
  },
  "unlocks": [],
  "tags": [
    "pressure",
    "thicken",
    "thicken",
    "remix"
  ]
}
