{
  "id": "06_far_side",
  "index": 6,
  "slug": "far_side",
  "title": "Far Side",
  "caption": "Rotation. Your path prints on the opposite corner.",
  "act": "induction",
  "act_index": 0,
  "act_title": "Induction",
  "teaches": "rotate_180",
  "transform": "rotate_180",
  "difficulty": 2,
  "role": "lesson",
  "seed": 11007,
  "daily_eligible": true,
  "par_moves": 44,
  "tempo_start": 9999,
  "lattice": {
    "rows": 14,
    "cols": 24,
    "cells": [
      "########################",
      "#P....................##",
      "#.####################.#",
      "#......................#",
      "#.####################.#",
      "#......................#",
      "#.###########C#########.",
      "#......................#",
      "#.####################.#",
      "#......................#",
      "#.####################.#",
      "#......................#",
      "##....................G#",
      "########################"
    ]
  },
  "map": [
    "########################",
    "#P....................##",
    "#.####################.#",
    "#......................#",
    "#.####################.#",
    "#......................#",
    "#.###########C#########.",
    "#......................#",
    "#.####################.#",
    "#......................#",
    "#.####################.#",
    "#......................#",
    "##....................G#",
    "########################"
  ],
  "motifs": [
    {
      "id": "M1",
      "kind": "CHECKPOINT",
      "cell": [
        13,
        6
      ],
      "unique": true,
      "operator": "rotate_180",
      "banner": "Rotation. Your path prints on the opposite corner."
    }
  ],
  "resonance": {
    "kind": "REACH_GOAL"
  },
  "rewrite": {
    "cap": 1,
    "forced_op": "rotate_180",
    "soft_hard_bias": 0.25,
    "require_shorter_or_equal": false
  },
  "hints": [
    "180\u00b0: every step lands diagonally opposite."
  ],
  "variations": {
    "allow_rotate": false,
    "allow_reflect": true,
    "allow_palette_swap": true,
    "budget_deltas": [
      0
    ],
    "hard_mode": {
      "tempo_delta": -4,
      "par_moves_mult": 0.85
    }
  },
  "unlocks": [],
  "tags": [
    "induction",
    "rotate_180",
    "rotate_180",
    "lesson"
  ]
}
