{
  "id": "14_horizon_fold",
  "index": 14,
  "slug": "horizon_fold",
  "title": "Horizon Fold",
  "caption": "Two horizontal folds. The middle remembers both.",
  "act": "reflection",
  "act_index": 1,
  "act_title": "Reflection",
  "teaches": "mirror_h",
  "transform": "mirror_h",
  "difficulty": 3,
  "role": "remix",
  "seed": 12006,
  "daily_eligible": true,
  "par_moves": 66,
  "tempo_start": 9999,
  "lattice": {
    "rows": 14,
    "cols": 24,
    "cells": [
      "########################",
      "#P.....................#",
      "#.##################.#.#",
      "#....................#.#",
      "#.#.##################.#",
      "#.#........C...........#",
      "#.##################.#.#",
      "#....................#.#",
      "#.#.##################.#",
      "#.#........C...........#",
      "#.##################.#.#",
      "#....................#.#",
      "#.#.##################G#",
      "########################"
    ]
  },
  "map": [
    "########################",
    "#P.....................#",
    "#.##################.#.#",
    "#....................#.#",
    "#.#.##################.#",
    "#.#........C...........#",
    "#.##################.#.#",
    "#....................#.#",
    "#.#.##################.#",
    "#.#........C...........#",
    "#.##################.#.#",
    "#....................#.#",
    "#.#.##################G#",
    "########################"
  ],
  "motifs": [
    {
      "id": "M1",
      "kind": "CHECKPOINT",
      "cell": [
        11,
        5
      ],
      "unique": true,
      "operator": "mirror_h",
      "banner": "Two horizontal folds. The middle remembers both."
    },
    {
      "id": "M2",
      "kind": "CHECKPOINT",
      "cell": [
        11,
        9
      ],
      "unique": true,
      "operator": "mirror_h",
      "banner": ""
    }
  ],
  "resonance": {
    "kind": "REACH_GOAL"
  },
  "rewrite": {
    "cap": 2,
    "forced_op": "mirror_h",
    "soft_hard_bias": 0.45,
    "require_shorter_or_equal": false
  },
  "hints": [],
  "variations": {
    "allow_rotate": false,
    "allow_reflect": false,
    "allow_palette_swap": true,
    "budget_deltas": [
      0
    ],
    "hard_mode": {
      "tempo_delta": -8,
      "par_moves_mult": 0.85
    }
  },
  "unlocks": [],
  "tags": [
    "reflection",
    "mirror_h",
    "mirror_h",
    "remix"
  ]
}
