{
  "id": "15_spin_gallery",
  "index": 15,
  "slug": "spin_gallery",
  "title": "Spin Gallery",
  "caption": "Rotate twice \u2014 leave a staggered signature.",
  "act": "reflection",
  "act_index": 1,
  "act_title": "Reflection",
  "teaches": "rotate_180",
  "transform": "rotate_180",
  "difficulty": 3,
  "role": "remix",
  "seed": 12007,
  "daily_eligible": true,
  "par_moves": 68,
  "tempo_start": 9999,
  "lattice": {
    "rows": 14,
    "cols": 24,
    "cells": [
      "########################",
      "#P....#..........#....##",
      "#.###.#.########.#.###.#",
      "#.....#..........#.....#",
      "#.#####.########.#####.#",
      "#..........C...........#",
      "#.#####.########.#####.#",
      "#.....#..........#.....#",
      "#.###.#.########.#.###.#",
      "#.....#....C.....#.....#",
      "#.#####.########.#####.#",
      "##....#..........#....G#",
      "########################",
      "########################"
    ]
  },
  "map": [
    "########################",
    "#P....#..........#....##",
    "#.###.#.########.#.###.#",
    "#.....#..........#.....#",
    "#.#####.########.#####.#",
    "#..........C...........#",
    "#.#####.########.#####.#",
    "#.....#..........#.....#",
    "#.###.#.########.#.###.#",
    "#.....#....C.....#.....#",
    "#.#####.########.#####.#",
    "##....#..........#....G#",
    "########################",
    "########################"
  ],
  "motifs": [
    {
      "id": "M1",
      "kind": "CHECKPOINT",
      "cell": [
        11,
        5
      ],
      "unique": true,
      "operator": "rotate_180",
      "banner": "Rotate twice \u2014 leave a staggered signature."
    },
    {
      "id": "M2",
      "kind": "CHECKPOINT",
      "cell": [
        11,
        9
      ],
      "unique": true,
      "operator": "rotate_180",
      "banner": ""
    }
  ],
  "resonance": {
    "kind": "REACH_GOAL"
  },
  "rewrite": {
    "cap": 2,
    "forced_op": "rotate_180",
    "soft_hard_bias": 0.45,
    "require_shorter_or_equal": false
  },
  "hints": [],
  "variations": {
    "allow_rotate": false,
    "allow_reflect": true,
    "allow_palette_swap": true,
    "budget_deltas": [
      0
    ],
    "hard_mode": {
      "tempo_delta": -8,
      "par_moves_mult": 0.85
    }
  },
  "unlocks": [],
  "tags": [
    "reflection",
    "rotate_180",
    "rotate_180",
    "remix"
  ]
}
