{
  "id": "18_cement_trail",
  "index": 18,
  "slug": "cement_trail",
  "title": "Cement Trail",
  "caption": "One path thickens. Do not return.",
  "act": "pressure",
  "act_index": 2,
  "act_title": "Pressure",
  "teaches": "thicken",
  "transform": "thicken",
  "difficulty": 3,
  "role": "lesson",
  "seed": 13001,
  "daily_eligible": true,
  "par_moves": 55,
  "tempo_start": 9999,
  "lattice": {
    "rows": 14,
    "cols": 24,
    "cells": [
      "########################",
      "#P.....................#",
      "#.####################.#",
      "#......................#",
      "#.####################.#",
      "#..........C...........#",
      "#.####################.#",
      "#......................#",
      "#.####################.#",
      "#......................#",
      "#.####################.#",
      "#......................#",
      "#.....................G#",
      "########################"
    ]
  },
  "map": [
    "########################",
    "#P.....................#",
    "#.####################.#",
    "#......................#",
    "#.####################.#",
    "#..........C...........#",
    "#.####################.#",
    "#......................#",
    "#.####################.#",
    "#......................#",
    "#.####################.#",
    "#......................#",
    "#.....................G#",
    "########################"
  ],
  "motifs": [
    {
      "id": "M1",
      "kind": "CHECKPOINT",
      "cell": [
        11,
        5
      ],
      "unique": true,
      "operator": "thicken",
      "banner": "One path thickens. Do not return."
    }
  ],
  "resonance": {
    "kind": "REACH_GOAL"
  },
  "rewrite": {
    "cap": 3,
    "forced_op": "thicken",
    "soft_hard_bias": 0.65,
    "require_shorter_or_equal": false
  },
  "hints": [],
  "variations": {
    "allow_rotate": true,
    "allow_reflect": true,
    "allow_palette_swap": true,
    "budget_deltas": [
      0
    ],
    "hard_mode": {
      "tempo_delta": -8,
      "par_moves_mult": 0.85
    }
  },
  "unlocks": [],
  "tags": [
    "pressure",
    "thicken",
    "thicken",
    "lesson"
  ]
}
