{
  "id": "31_last_buffer",
  "index": 31,
  "slug": "last_buffer",
  "title": "Last Buffer",
  "caption": "Thicken mastery \u2014 the buffer is almost full.",
  "act": "mastery",
  "act_index": 3,
  "act_title": "Mastery",
  "teaches": "thicken",
  "transform": "thicken",
  "difficulty": 5,
  "role": "remix",
  "seed": 14005,
  "daily_eligible": true,
  "par_moves": 80,
  "tempo_start": 9999,
  "lattice": {
    "rows": 14,
    "cols": 24,
    "cells": [
      "########################",
      "#P.....................#",
      "#.#.##.#.##.#.##.#.##..#",
      "#.#....#....#....#.....#",
      "#.#.####.####.####.###.#",
      "#.#........C...........#",
      "#.#.####.####.####.###.#",
      "#.#....#....#....#.....#",
      "#.#.##.#.##.#.##.#.##..#",
      "#.#....#....#....#.....#",
      "#.#.####.####.####.###.#",
      "#.#....................#",
      "#.####################G#",
      "########################"
    ]
  },
  "map": [
    "########################",
    "#P.....................#",
    "#.#.##.#.##.#.##.#.##..#",
    "#.#....#....#....#.....#",
    "#.#.####.####.####.###.#",
    "#.#........C...........#",
    "#.#.####.####.####.###.#",
    "#.#....#....#....#.....#",
    "#.#.##.#.##.#.##.#.##..#",
    "#.#....#....#....#.....#",
    "#.#.####.####.####.###.#",
    "#.#....................#",
    "#.####################G#",
    "########################"
  ],
  "motifs": [
    {
      "id": "M1",
      "kind": "CHECKPOINT",
      "cell": [
        11,
        5
      ],
      "unique": true,
      "operator": "thicken",
      "banner": "Thicken mastery \u2014 the buffer is almost full."
    }
  ],
  "resonance": {
    "kind": "REACH_GOAL"
  },
  "rewrite": {
    "cap": 3,
    "forced_op": "thicken",
    "soft_hard_bias": 0.8500000000000001,
    "require_shorter_or_equal": false
  },
  "hints": [],
  "variations": {
    "allow_rotate": true,
    "allow_reflect": true,
    "allow_palette_swap": true,
    "budget_deltas": [
      0
    ],
    "hard_mode": {
      "tempo_delta": -8,
      "par_moves_mult": 0.85
    }
  },
  "unlocks": [],
  "tags": [
    "mastery",
    "thicken",
    "thicken",
    "remix"
  ]
}
