{
  "id": "07_first_thicken",
  "index": 7,
  "slug": "first_thicken",
  "title": "First Thicken",
  "caption": "Habits solidify where you stepped. Do not re-tread.",
  "act": "induction",
  "act_index": 0,
  "act_title": "Induction",
  "teaches": "thicken",
  "transform": "thicken",
  "difficulty": 2,
  "role": "lesson",
  "seed": 11008,
  "daily_eligible": true,
  "par_moves": 46,
  "tempo_start": 9999,
  "lattice": {
    "rows": 14,
    "cols": 24,
    "cells": [
      "########################",
      "#P.....................#",
      "#.####################.#",
      "#......................#",
      "#.####################.#",
      "#......................#",
      "#.#####....C....#####..#",
      "#......................#",
      "#.####################.#",
      "#......................#",
      "#.####################.#",
      "#......................#",
      "#.....................G#",
      "########################"
    ]
  },
  "map": [
    "########################",
    "#P.....................#",
    "#.####################.#",
    "#......................#",
    "#.####################.#",
    "#......................#",
    "#.#####....C....#####..#",
    "#......................#",
    "#.####################.#",
    "#......................#",
    "#.####################.#",
    "#......................#",
    "#.....................G#",
    "########################"
  ],
  "motifs": [
    {
      "id": "M1",
      "kind": "CHECKPOINT",
      "cell": [
        11,
        6
      ],
      "unique": true,
      "operator": "thicken",
      "banner": "Habits solidify where you stepped. Do not re-tread."
    }
  ],
  "resonance": {
    "kind": "REACH_GOAL"
  },
  "rewrite": {
    "cap": 1,
    "forced_op": "thicken",
    "soft_hard_bias": 0.25,
    "require_shorter_or_equal": false
  },
  "hints": [
    "After the checkpoint, your trail becomes wall."
  ],
  "variations": {
    "allow_rotate": true,
    "allow_reflect": true,
    "allow_palette_swap": true,
    "budget_deltas": [
      0
    ],
    "hard_mode": {
      "tempo_delta": -4,
      "par_moves_mult": 0.85
    }
  },
  "unlocks": [],
  "tags": [
    "induction",
    "thicken",
    "thicken",
    "lesson"
  ]
}
