{
  "id": "37_cement_trail_hard",
  "index": 37,
  "slug": "cement_trail_hard",
  "title": "Cement Trail+",
  "caption": "Hard. Thicken with fewer detours.",
  "act": "pressure",
  "act_index": 2,
  "act_title": "Pressure",
  "teaches": "thicken",
  "transform": "thicken",
  "difficulty": 4,
  "role": "hard",
  "seed": 23001,
  "daily_eligible": true,
  "hard_variant_of": "cement_trail",
  "par_moves": 65,
  "tempo_start": 9999,
  "lattice": {
    "rows": 14,
    "cols": 24,
    "cells": [
      "########################",
      "#P###################..#",
      "#......................#",
      "#.####################.#",
      "#......................#",
      "#.##########C#########.#",
      "#......................#",
      "#.####################.#",
      "#......................#",
      "#.####################.#",
      "#......................#",
      "#.####################.#",
      "#.....................G#",
      "########################"
    ]
  },
  "map": [
    "########################",
    "#P###################..#",
    "#......................#",
    "#.####################.#",
    "#......................#",
    "#.##########C#########.#",
    "#......................#",
    "#.####################.#",
    "#......................#",
    "#.####################.#",
    "#......................#",
    "#.####################.#",
    "#.....................G#",
    "########################"
  ],
  "motifs": [
    {
      "id": "M1",
      "kind": "CHECKPOINT",
      "cell": [
        12,
        5
      ],
      "unique": true,
      "operator": "thicken",
      "banner": "Hard. Thicken with fewer detours."
    }
  ],
  "resonance": {
    "kind": "REACH_GOAL"
  },
  "rewrite": {
    "cap": 3,
    "forced_op": "thicken",
    "soft_hard_bias": 0.65,
    "require_shorter_or_equal": false
  },
  "hints": [],
  "variations": {
    "allow_rotate": true,
    "allow_reflect": true,
    "allow_palette_swap": true,
    "budget_deltas": [
      0,
      1
    ],
    "hard_mode": {
      "tempo_delta": -8,
      "par_moves_mult": 0.85
    }
  },
  "unlocks": [],
  "tags": [
    "pressure",
    "thicken",
    "thicken",
    "hard"
  ]
}
