{
  "id": "11_opposite_room",
  "index": 11,
  "slug": "opposite_room",
  "title": "Opposite Room",
  "caption": "Turn the chamber inside-out with one rotation.",
  "act": "reflection",
  "act_index": 1,
  "act_title": "Reflection",
  "teaches": "rotate_180",
  "transform": "rotate_180",
  "difficulty": 2,
  "role": "remix",
  "seed": 12003,
  "daily_eligible": true,
  "par_moves": 56,
  "tempo_start": 9999,
  "lattice": {
    "rows": 14,
    "cols": 24,
    "cells": [
      "########################",
      "#P...#................##",
      "#.##.#.##############..#",
      "#....#.................#",
      "#.####.##############..#",
      "#......................#",
      "#.##########C#########.#",
      "#......................#",
      "#..##############.####.#",
      "#.................#....#",
      "#..##############.#.##.#",
      "##................#...G#",
      "########################",
      "########################"
    ]
  },
  "map": [
    "########################",
    "#P...#................##",
    "#.##.#.##############..#",
    "#....#.................#",
    "#.####.##############..#",
    "#......................#",
    "#.##########C#########.#",
    "#......................#",
    "#..##############.####.#",
    "#.................#....#",
    "#..##############.#.##.#",
    "##................#...G#",
    "########################",
    "########################"
  ],
  "motifs": [
    {
      "id": "M1",
      "kind": "CHECKPOINT",
      "cell": [
        12,
        6
      ],
      "unique": true,
      "operator": "rotate_180",
      "banner": "Turn the chamber inside-out with one rotation."
    }
  ],
  "resonance": {
    "kind": "REACH_GOAL"
  },
  "rewrite": {
    "cap": 2,
    "forced_op": "rotate_180",
    "soft_hard_bias": 0.45,
    "require_shorter_or_equal": false
  },
  "hints": [],
  "variations": {
    "allow_rotate": false,
    "allow_reflect": true,
    "allow_palette_swap": true,
    "budget_deltas": [
      0
    ],
    "hard_mode": {
      "tempo_delta": -4,
      "par_moves_mult": 0.85
    }
  },
  "unlocks": [],
  "tags": [
    "reflection",
    "rotate_180",
    "rotate_180",
    "remix"
  ]
}
