{
  "id": "01_echo_plate",
  "index": 1,
  "slug": "echo_plate",
  "title": "Echo Plate",
  "caption": "Turn once. The lattice is still asleep.",
  "act": "induction",
  "act_index": 0,
  "act_title": "Induction",
  "teaches": "turn",
  "transform": "none",
  "difficulty": 0,
  "role": "lesson",
  "seed": 11002,
  "daily_eligible": false,
  "par_moves": 34,
  "tempo_start": 9999,
  "lattice": {
    "rows": 14,
    "cols": 24,
    "cells": [
      "########################",
      "#P.....................#",
      "#.####################.#",
      "#.####################.#",
      "#.####################.#",
      "#.####################.#",
      "#.####################.#",
      "#.####################.#",
      "#.####################.#",
      "#.####################.#",
      "#.####################.#",
      "#.####################.#",
      "#.....................G#",
      "########################"
    ]
  },
  "map": [
    "########################",
    "#P.....................#",
    "#.####################.#",
    "#.####################.#",
    "#.####################.#",
    "#.####################.#",
    "#.####################.#",
    "#.####################.#",
    "#.####################.#",
    "#.####################.#",
    "#.####################.#",
    "#.####################.#",
    "#.....................G#",
    "########################"
  ],
  "motifs": [],
  "resonance": {
    "kind": "REACH_GOAL"
  },
  "rewrite": {
    "cap": 1,
    "forced_op": "none",
    "soft_hard_bias": 0.25,
    "require_shorter_or_equal": false
  },
  "hints": [
    "The corridor forces a single corner."
  ],
  "variations": {
    "allow_rotate": true,
    "allow_reflect": true,
    "allow_palette_swap": true,
    "budget_deltas": [
      0
    ],
    "hard_mode": {
      "tempo_delta": -4,
      "par_moves_mult": 0.85
    }
  },
  "unlocks": [],
  "tags": [
    "induction",
    "turn",
    "none",
    "lesson"
  ]
}
