{
  "id": "20_squeeze_mirror",
  "index": 20,
  "slug": "squeeze_mirror",
  "title": "Squeeze Mirror",
  "caption": "Tight lanes. A messy path seals everything.",
  "act": "pressure",
  "act_index": 2,
  "act_title": "Pressure",
  "teaches": "mirror_v",
  "transform": "mirror_v",
  "difficulty": 3,
  "role": "remix",
  "seed": 13003,
  "daily_eligible": true,
  "par_moves": 60,
  "tempo_start": 9999,
  "lattice": {
    "rows": 14,
    "cols": 24,
    "cells": [
      "########################",
      "#P.#.#.#.#.#.#.#.#.#...#",
      "#......................#",
      "#.#.#.#.#.#.#.#.#.#.#.##",
      "#......................#",
      "#.#.#.#.#.C.#.#.#.#.#..#",
      "#......................#",
      "##.#.#.#.#.#.#.#.#.#.#.#",
      "#......................#",
      "#.#.#.#.#.#.#.#.#.#.#.##",
      "#......................#",
      "#.#.#.#.#.#.#.#.#.#.#..#",
      "#.....................G#",
      "########################"
    ]
  },
  "map": [
    "########################",
    "#P.#.#.#.#.#.#.#.#.#...#",
    "#......................#",
    "#.#.#.#.#.#.#.#.#.#.#.##",
    "#......................#",
    "#.#.#.#.#.C.#.#.#.#.#..#",
    "#......................#",
    "##.#.#.#.#.#.#.#.#.#.#.#",
    "#......................#",
    "#.#.#.#.#.#.#.#.#.#.#.##",
    "#......................#",
    "#.#.#.#.#.#.#.#.#.#.#..#",
    "#.....................G#",
    "########################"
  ],
  "motifs": [
    {
      "id": "M1",
      "kind": "CHECKPOINT",
      "cell": [
        10,
        5
      ],
      "unique": true,
      "operator": "mirror_v",
      "banner": "Tight lanes. A messy path seals everything."
    }
  ],
  "resonance": {
    "kind": "REACH_GOAL"
  },
  "rewrite": {
    "cap": 3,
    "forced_op": "mirror_v",
    "soft_hard_bias": 0.65,
    "require_shorter_or_equal": false
  },
  "hints": [],
  "variations": {
    "allow_rotate": false,
    "allow_reflect": false,
    "allow_palette_swap": true,
    "budget_deltas": [
      0
    ],
    "hard_mode": {
      "tempo_delta": -8,
      "par_moves_mult": 0.85
    }
  },
  "unlocks": [],
  "tags": [
    "pressure",
    "mirror_v",
    "mirror_v",
    "remix"
  ]
}
